[
  {
    "id": "src_pub_quarantine",
    "object_type": "source",
    "title": "Etymology of \"quarantine\"",
    "created_at": "2026-01-05T00:00:00Z",
    "provenance": { "origin": "public_domain_reference", "author": "historical record", "external_participants": [] },
    "epistemic_class": "external_factual_authority",
    "sensitivity": "public",
    "permissions_profile": "public_source",
    "permissions": {
      "retrieve_raw": ["owner_local_processing", "private_cloud_processing"],
      "send_to_external_model": [],
      "derive_constraints": true,
      "quote_in_private_receipt": true,
      "quote_in_public_receipt": true,
      "use_for_training": false
    },
    "permission_overrides": [],
    "tags": ["etymology", "institutional_power", "containment"],
    "review_status": "approved",
    "revoked": false,
    "version": 1
  },
  {
    "id": "src_pub_exile",
    "object_type": "source",
    "title": "History of exile as institutional punishment",
    "created_at": "2026-01-05T00:00:00Z",
    "provenance": { "origin": "public_domain_reference", "author": "historical record", "external_participants": [] },
    "epistemic_class": "external_factual_authority",
    "sensitivity": "public",
    "permissions_profile": "public_source",
    "permissions": {
      "retrieve_raw": ["owner_local_processing", "private_cloud_processing"],
      "send_to_external_model": [],
      "derive_constraints": true,
      "quote_in_private_receipt": true,
      "quote_in_public_receipt": true,
      "use_for_training": false
    },
    "permission_overrides": [],
    "tags": ["etymology", "exile", "departure"],
    "review_status": "approved",
    "revoked": false,
    "version": 1
  },
  {
    "id": "src_pub_parole",
    "object_type": "source",
    "title": "Etymology of \"parole\"",
    "created_at": "2026-01-05T00:00:00Z",
    "provenance": { "origin": "public_domain_reference", "author": "historical record", "external_participants": [] },
    "epistemic_class": "external_factual_authority",
    "sensitivity": "public",
    "permissions_profile": "public_source",
    "permissions": {
      "retrieve_raw": ["owner_local_processing", "private_cloud_processing"],
      "send_to_external_model": [],
      "derive_constraints": true,
      "quote_in_private_receipt": true,
      "quote_in_public_receipt": true,
      "use_for_training": false
    },
    "permission_overrides": [],
    "tags": ["etymology", "conditional_release", "institutional_power"],
    "review_status": "approved",
    "revoked": false,
    "version": 1
  },
  {
    "id": "src_pub_scapegoat",
    "object_type": "source",
    "title": "Origin of \"scapegoat\"",
    "created_at": "2026-01-05T00:00:00Z",
    "provenance": { "origin": "public_domain_reference", "author": "historical record", "external_participants": [] },
    "epistemic_class": "primary_historical_source",
    "sensitivity": "public",
    "permissions_profile": "public_source",
    "permissions": {
      "retrieve_raw": ["owner_local_processing", "private_cloud_processing"],
      "send_to_external_model": [],
      "derive_constraints": true,
      "quote_in_private_receipt": true,
      "quote_in_public_receipt": true,
      "use_for_training": false
    },
    "permission_overrides": [],
    "tags": ["etymology", "religious_ritual", "expulsion"],
    "review_status": "approved",
    "revoked": false,
    "version": 1
  },
  {
    "id": "src_pub_liminal",
    "object_type": "source",
    "title": "\"Liminal\" in anthropological usage",
    "created_at": "2026-01-05T00:00:00Z",
    "provenance": { "origin": "public_domain_reference", "author": "historical record", "external_participants": [] },
    "epistemic_class": "secondary_scholarship",
    "sensitivity": "public",
    "permissions_profile": "public_source",
    "permissions": {
      "retrieve_raw": ["owner_local_processing", "private_cloud_processing"],
      "send_to_external_model": [],
      "derive_constraints": true,
      "quote_in_private_receipt": true,
      "quote_in_public_receipt": true,
      "use_for_training": false
    },
    "permission_overrides": [],
    "tags": ["etymology", "threshold", "anthropology"],
    "review_status": "approved",
    "revoked": false,
    "version": 1
  },
  {
    "id": "src_pub_pedagogue",
    "object_type": "source",
    "title": "Etymology of \"pedagogue\"",
    "created_at": "2026-08-22T00:00:00Z",
    "provenance": { "origin": "public_domain_reference", "author": "historical record", "external_participants": [] },
    "epistemic_class": "external_factual_authority",
    "sensitivity": "public",
    "permissions_profile": "public_source",
    "permissions": {
      "retrieve_raw": ["owner_local_processing", "private_cloud_processing"],
      "send_to_external_model": [],
      "derive_constraints": true,
      "quote_in_private_receipt": true,
      "quote_in_public_receipt": true,
      "use_for_training": false
    },
    "permission_overrides": [],
    "tags": ["etymology", "education", "supervision"],
    "review_status": "approved",
    "revoked": false,
    "version": 1
  },
  {
    "id": "src_pub_mortgage",
    "object_type": "source",
    "title": "Etymology of \"mortgage\"",
    "created_at": "2026-08-22T00:00:00Z",
    "provenance": { "origin": "public_domain_reference", "author": "historical record", "external_participants": [] },
    "epistemic_class": "external_factual_authority",
    "sensitivity": "public",
    "permissions_profile": "public_source",
    "permissions": {
      "retrieve_raw": ["owner_local_processing", "private_cloud_processing"],
      "send_to_external_model": [],
      "derive_constraints": true,
      "quote_in_private_receipt": true,
      "quote_in_public_receipt": true,
      "use_for_training": false
    },
    "permission_overrides": [],
    "tags": ["etymology", "debt", "conditional_property"],
    "review_status": "approved",
    "revoked": false,
    "version": 1
  },
  {
    "id": "src_pub_sabotage",
    "object_type": "source",
    "title": "Etymology of \"sabotage\"",
    "created_at": "2026-08-22T00:00:00Z",
    "provenance": { "origin": "public_domain_reference", "author": "historical record", "external_participants": [] },
    "epistemic_class": "external_factual_authority",
    "sensitivity": "public",
    "permissions_profile": "public_source",
    "permissions": {
      "retrieve_raw": ["owner_local_processing", "private_cloud_processing"],
      "send_to_external_model": [],
      "derive_constraints": true,
      "quote_in_private_receipt": true,
      "quote_in_public_receipt": true,
      "use_for_training": false
    },
    "permission_overrides": [],
    "tags": ["etymology", "labor", "resistance"],
    "review_status": "approved",
    "revoked": false,
    "version": 1
  },
  {
    "id": "src_pub_propaganda",
    "object_type": "source",
    "title": "Etymology of \"propaganda\"",
    "created_at": "2026-08-22T00:00:00Z",
    "provenance": { "origin": "public_domain_reference", "author": "historical record", "external_participants": [] },
    "epistemic_class": "external_factual_authority",
    "sensitivity": "public",
    "permissions_profile": "public_source",
    "permissions": {
      "retrieve_raw": ["owner_local_processing", "private_cloud_processing"],
      "send_to_external_model": [],
      "derive_constraints": true,
      "quote_in_private_receipt": true,
      "quote_in_public_receipt": true,
      "use_for_training": false
    },
    "permission_overrides": [],
    "tags": ["etymology", "belief", "institution"],
    "review_status": "approved",
    "revoked": false,
    "version": 1
  },
  {
    "id": "src_pub_orphan",
    "object_type": "source",
    "title": "Etymology of \"orphan\"",
    "created_at": "2026-08-22T00:00:00Z",
    "provenance": { "origin": "public_domain_reference", "author": "historical record", "external_participants": [] },
    "epistemic_class": "external_factual_authority",
    "sensitivity": "public",
    "permissions_profile": "public_source",
    "permissions": {
      "retrieve_raw": ["owner_local_processing", "private_cloud_processing"],
      "send_to_external_model": [],
      "derive_constraints": true,
      "quote_in_private_receipt": true,
      "quote_in_public_receipt": true,
      "use_for_training": false
    },
    "permission_overrides": [],
    "tags": ["etymology", "kinship", "loss"],
    "review_status": "approved",
    "revoked": false,
    "version": 1
  },
  {
    "id": "src_pub_hybrid",
    "object_type": "source",
    "title": "Etymology of \"hybrid\"",
    "created_at": "2026-08-22T00:00:00Z",
    "provenance": { "origin": "public_domain_reference", "author": "historical record", "external_participants": [] },
    "epistemic_class": "external_factual_authority",
    "sensitivity": "public",
    "permissions_profile": "public_source",
    "permissions": {
      "retrieve_raw": ["owner_local_processing", "private_cloud_processing"],
      "send_to_external_model": [],
      "derive_constraints": true,
      "quote_in_private_receipt": true,
      "quote_in_public_receipt": true,
      "use_for_training": false
    },
    "permission_overrides": [],
    "tags": ["etymology", "biology", "boundary_crossing"],
    "review_status": "approved",
    "revoked": false,
    "version": 1
  },
  {
    "id": "src_pub_nostalgia",
    "object_type": "source",
    "title": "Etymology of \"nostalgia\"",
    "created_at": "2026-08-22T00:00:00Z",
    "provenance": { "origin": "public_domain_reference", "author": "historical record", "external_participants": [] },
    "epistemic_class": "external_factual_authority",
    "sensitivity": "public",
    "permissions_profile": "public_source",
    "permissions": {
      "retrieve_raw": ["owner_local_processing", "private_cloud_processing"],
      "send_to_external_model": [],
      "derive_constraints": true,
      "quote_in_private_receipt": true,
      "quote_in_public_receipt": true,
      "use_for_training": false
    },